{
  "schema": "https://ai-atoms.com/schemas/hook-v1.json",
  "type": "hook",
  "id": "hook/secret-precommit",
  "version": "1.0.0",
  "name": "Secret Pre-commit Scanner",
  "description": "Git pre-commit hook and CI scanner that blocks commits containing secret-shaped strings. Two modes: (1) pre-commit — scans the staged diff (git diff --cached -U0) and aborts the commit on any match; (2) CI/range scan (--ci --base BASE --head HEAD) — scans the diff from BASE..HEAD for use in secret-scan.yml workflows. Reads canonical patterns from hooks/patterns.json.",
  "event": "PreToolUse",
  "language": "python",
  "trigger": {"type": "tool-name", "pattern": "Bash"},
  "blocking": true,
  "side_effects": ["aborts git commit on secret detection", "exits non-zero in CI scan mode on detection"],
  "authored_by": "convergent-systems-key",
  "tags": ["security", "secrets", "git", "pre-commit", "ci", "claude-code"],
  "lifecycle": "stable"
}
